{
    "GEOMETRY_ENGINE": "ODL",
    "GEOMETRY_NAME": "ConeBeamGeometry",
    "DET_NPX_Z": 512,
    "DET_NPX_X": 512,
    "DET_PIX_SIZE": 0.078125,
    "DET_X_MIN": -0.098174770424681035,
    "DET_X_MAX": 0.098174770424681035,
    "DET_Z_MIN": -20.0,
    "DET_Z_MAX": 20.0,
    "SRC_RADIUS": 200.0,
    "DET_RADIUS": 200.0,
    "DET_CURVATURE_RADIUS": 400.0,
    "ROTATION_AXIS": [0.0, 0.0, 1.0],
    "REC_PIC_SIZE": 0.13333333333333333,
    "REC_NPX_X": 300,
    "REC_NPX_Y": 300,
    "REC_NPX_Z": 300,
    "REC_MIN_X": -20.0,
    "REC_MAX_X": 20.0,
    "REC_MIN_Y": -20.0,
    "REC_MAX_Y": 20.0,
    "REC_MIN_Z": -20.0,
    "REC_MAX_Z": 20.0
}